id,archived,short_en,title_en
0,1,Support for global treaty,UN Member States’ level of support for treaty
1,,Reduce,"Support for treaty’s global, binding measures to minimise total pollution through reduction and elimination of the production of problematic plastics"
2,,Circulate,"Support for treaty’s global, binding measures to minimise total pollution through increased and non-toxic circulation of plastic products"
3,,Manage,"Support for treaty’s global, binding measures to minimise total pollution through improved waste management, remediation activities, and other measures"
4,,Implementation support,Support for treaty’s mechanism to provide necessary support to countries for the implementation of the treaty’s obligations